"Notice Identifier","Notice Type","Organisation Name",Status,"Published Date",Title,Description,Nationwide,Postcode,Region,"Cpv Codes","Contact Name","Contact Email","Contact Address 1","Contact Address 2","Contact Town","Contact Postcode","Contact Country","Contact Telephone","Contact Website",Attachments,Links,"Additional Text","Start Date","End Date","Closing Date","Is sub-contract","Parent Reference","Suitable for SME","Suitable for VCO","Supply Chain","OJEU Contract Type","Value Low","Value High","Awarded Date","Awarded Value","Supplier [Name|Address|Ref type|Ref Number|Is SME|Is VCSE]","Supplier's contact name","Contract start date","Contract end date","OJEU Procedure Type","Accelerated Justification","Closing Time"
PRO1002409,Contract,"NHS PROPERTY SERVICES LIMITED",Awarded,2024-05-29T15:28:35+01:00,"PR Platform Service","PR Services",,,England,"79416000 ","NHS PS Procurement",NHSPSContracts@property.nhs.uk,"Regent House","Heaton Lane",STOCKPORT,"SK4 1BS","United Kingdom",,,,,,01/04/2022,31/03/2025,25/02/2022,NO,,Yes,No,No,Services,53670.01,,15/02/2022,53670.01,"[ACCESS INTELLIGENCE MEDIA AND COMMUNICATIONS LIMITED|The Johnson Building, 79 Hatton Garden, London, England, EC1N 8AW|COMPANIES_HOUSE|03819220|Yes|No]",,01/04/2022,31/03/2025,"CompetitiveQuotationNonOJEU ",,12:00
C-2553,Contract,"National Audit Office",Awarded,2022-07-15T11:28:09+01:00,"2022 Main Laptop refresh","The supply of laptops contract with ACS Systems UK LIMITED had a 4 months contract duration that commenced on Friday 24th June 2022 until Monday 31st October 2022 with optional extension period of 3 years until Friday 24th October 2025.

The contract was extended with ACS Systems UK LIMITED for 2 years and 9 months from Tuesday 1st November 2022 until Tuesday 28th January 2025.

As of May 2024, the contract was varied by £199,034.40 inclusive of VAT to purchase  additional laptops.",,"SW1W 9SP",,"30200000 ","Tania Khan",NAO.Procurement@nao.org.uk,"157-197 Buckingham Palace Road",,LONDON,SW1W9SP,England,02077987000,,,,,24/06/2022,28/01/2025,01/02/2022,NO,,Yes,No,No,Products,1800000,2223780,17/02/2022,2223780,"[ACS SYSTEMS UK LIMITED|A C S House,Oxwich Close, Brackmills Industrial Estate
NORTHAMPTON
Northamptonshire
NN4 7BH
GB|COMPANIES_HOUSE|02988060|Yes|No]",,24/06/2022,28/01/2025,"CallOffFromFrameworkAgreement ",,17:00
OLDH001-DN579415-02663703,Contract,"Oldham Council",Awarded,2024-05-07T13:18:20+01:00,"Spindles Phase 2 - Redevelopment and Repurposing of the Spindles Shopping Centre","Spindles Phase 2 - Redevelopment and Repurposing of the Spindles Shopping Centre, procured on a 2 stage tender basis, initially under a pre-construction services agreement.",,,"North East,North West,Yorkshire and The Humber,East Midlands,West Midlands,East of England,London,South East,South West","45000000 ","Dan Cheetham",dan.cheetham@oldham.gov.uk,"Civic Centre",,Oldham,"OL1 1UT","United Kingdom",,http://www.oldham.gov.uk/,,,,01/03/2022,05/01/2024,13/12/2021,NO,,Yes,Yes,No,Works,42000000,,16/02/2022,59000000,"[Willmott Dixon Construction Ltd|B46 3BP|NONE||No|No]",,01/03/2022,30/09/2025,"Other ",,12:00
CDIO-104,Contract,"Cabinet Office",Awarded,2022-03-08T11:35:37Z,"Objective ECM & Workflow System","Enterprise License includes Foundation, Records Management, Enterprise Document Management, Workflow and Approvals, Objective E-Learning CBT Training Module, Software support and Objective ECM Technial admin service.",,"SW1A 2BQ",,"48200000 48300000 48600000 48700000 48800000 48900000 ","CDIO Procurement",cdioprocurement@cabinetoffice.gov.uk,"100 Parliament Street",Westminster,LONDON,"SW1A 2BQ",England,07564849573,,"2022-02-15 CDIO 104 Objective ECM  Workflow system -Cloud-12-Call-Off-Contract _Redacted_v2_Final.pdf 2024-01-18  Signed -Final -Contract Variation # 2 - Objective Corporation  - CDIO-104_Redacted.pdf 15-03-23 - Variation 01 to CDIO-104 - Objective Corporation_Redacted.pdf ","https://drive.google.com/file/d/1JmSka3Yk4stBE0bcJQqdTO04vahwod70/view?usp=sharing https://drive.google.com/file/d/10hV1LZvu1pZrP5ANe4o8DTtj8loEJXk2/view?usp=drive_link https://drive.google.com/file/d/14TxpoKtRemOax7edkxeTDXJ_kZvgRmwK/view?usp=drive_link ",,17/01/2022,16/01/2025,16/01/2022,NO,,No,No,No,Services,322750,,14/02/2022,322750,"[Objective Corporation|Level 10, Thames Tower, Station Road, Reading, Berkshire, RG1 1LX|NONE_OTHER||No|No]",,17/01/2022,16/01/2025,"CallOffFromFrameworkAgreement ",,17:00
CS22094,Contract,"UK SHARED BUSINESS SERVICES LIMITED",Awarded,2024-03-19T16:55:35Z,"CS22094 Supplier Manager","***** THIS IS AN AWARD NOTICE, NOT A CALL FOR COMPETITION *****

This procurement is being concluded as a direct award under the Crown Commercial Services Framework, RM6160 Non Clinical Temporary and Fixed Term Staff Lot 2 

Brief Description of Requirement

The requirement was for the temporary provision of a Supplier Manager for UK Research and Innovation",,,"United Kingdom","79620000 ",,coreservices@uksbs.co.uk,"Polaris House,North Star Avenue",,SWINDON,SN21FF,England,,www.uksbs.co.uk,"Redacted Contract.pdf RM6160 - CS22094-004_redacted.pdf RM6277 Variation - CS22094-005 - Fully Signed_redacted.pdf ",,,28/02/2022,31/03/2025,14/02/2022,NO,,No,No,No,Services,489277.12,,14/02/2022,489277.12,"[Computer Futures (a trading division of SThree Partnership LLP)|1st Floor, 75 King William Street, London EC4N 7BE|COMPANIES_HOUSE|OC387148|Yes|No]",,28/02/2022,31/03/2025,"CallOffFromFrameworkAgreement ",,16:00
"Greater Cambridge Partnership A506 City Access Making Connections",Contract,"Cambridgeshire County Council",Awarded,2024-03-06T14:21:58Z,"GCP A506 City Access Making Connections","This was an award from Cambs County Council Joint Professional Services Framework to Atkins for consultancy support to the delivery of the Making Connections programme",,,"East of England","71311210 ","Karen Griggs",karen.griggs@cambridgeshire.gov.uk,"Mandela House","4 Regent Street","Cambridge, UK","CB2 1BY","United Kingdom","01223 699154",,,,,14/02/2022,31/07/2022,13/02/2022,NO,,Yes,Yes,No,Works,496947,,13/02/2022,496947,"[Atkins|12-16 Addiscombe Road
Croydon
CR0 0XT|COMPANIES_HOUSE|00688424|No|No]",,14/02/2022,31/07/2022,"CallOffFromFrameworkAgreement ",,00:00
DERBSCC001-DN712436-51620097,Contract,"Derbyshire County Council",Awarded,2024-02-22T11:20:14Z,"CT2111 Supply of P50 Fire Extinguishers","Supply of P50 Fire Extinguishers.",,,"East Midlands","35111300 ",,procurement.supportteam@derbyshire.gov.uk,"County Hall",,Matlock,"DE4 3AG",England,,http://www.derbyshire.gov.uk/,,,,14/02/2022,13/02/2026,12/02/2022,NO,,Yes,No,No,Products,25000,25000,13/02/2022,25000,"[Tower Fire Ltd|TOWER BUSINESS CENTRE - HIRWAUN IND ESTATE,
HIRWAUN
Mid Glamorgan
CF44 9UP|NONE||Yes|No]",,14/02/2022,13/02/2026,"Other ",,23:59
WARRINGTONLIVE001-DN574299-41430791,Contract,"Warrington Borough Council",Awarded,2024-02-12T15:02:03Z,"Electoral Services Print Service","Print supplier to provide elections and electoral registration printed materials in an efficient and professional manner with an end product that is expertly produced and will provide best value.

The Council area consists of 2 Parliamentary Constituencies - Warrington North and Warrington South, 22 Borough Wards, 18 Parish Councils with 42 Parish Wards. Warrington is within the Cheshire Police and Crime Commissioner Area.

The Councils election cycle is all out Borough and Parish elections every 4 years and the next all out elections are scheduled for 2024

The contract will initially be for a period of 5 years with the potential for 5 further extensions of 1 year",,,England,"22000000 ","Kathy Lang",klang@warrington.gov.uk,"New Town House","Buttermarket Street",Warrington,"WA1 2NH",England,"'+44 1925443905",http://www.warrington.gov.uk/,,"https://procontract.due-north.com/Advert?advertId=f1309633-b026-ec11-810e-005056b64545 ",,28/02/2022,27/02/2027,08/11/2021,YES,WARRINGTONLIVE001-DN574299-41524612,Yes,Yes,No,Products,800000,800000,14/02/2022,800000,"[Print Image Network Ltd|SK4 1AS|NONE||Yes|No]",,28/02/2022,27/02/2027,"Open ",,12:00
PROC-4869,Contract,"High Peak Borough Council & Staffordshire Moorlands District Council",Awarded,2024-01-18T15:22:01Z,"P4869 Glossop Town Hall and Municipal Building Sash Window Refurbishment & Clock Tower Works","High Peak Borough Council are inviting tenders from suitably experienced contractors to complete brought forward works to the Glossop halls project public building refurbishment in the Centre of Glossop Town Centre. The wider project procurement of main contractor is currently in progress, the Council in addition is looking to tender and appoint either one or two contractors (one for both lots or, separate contractor for either lot) to commence works in the New Year. 

The works include refurbishment works of the existing; 
• Lot 1 - Municipal Building - Refurbishment of sash windows 
• Lot 2 - Town Hall - Sash window refurbishment, clock tower repairs/refurbishment and secrete guttering alterations. 

The contract and works itemised in the ITT documents are required to be fully completed and invoiced on or before the 31st March 2022 as part of the D2N2 grant funding agreement. 

This exercise is being managed through the Council's Electronic tendering system Proactis. To Register an Interest and submit a tender for this opportunity please click on the link below,

You will need to register or log in (if you have already registered). If you have any queries or need assistance please contact us.

Reference: PROC-4869

Closing date for tenders is by 12:00 noon on 19 January 2022",,,"East Midlands","50000000 ",,procurement@highpeak.gov.uk,"Town Hall",,Buxton,SK176EL,England,"0345 129 77 77",www.highpeak.gov.uk,,"https://supplystokeandstaffs.proactishosting.com ",,01/02/2022,31/03/2022,19/01/2022,NO,,Yes,No,No,Works,100000,,17/02/2022,119290,"[Hankinson Ltd|2 Ivy Street 
Birkenhead 
CH41 5EF|NONE_OTHER||No|No]",,17/02/2022,31/03/2022,"OpenNonOJEU ",,12:00
PROC-4868,Contract,"High Peak Borough Council & Staffordshire Moorlands District Council",Awarded,2024-01-18T15:06:11Z,"P4868 Glossop Municipal Buildings Heating System Replacement","High Peak Borough Council wish to invite suitable contractors to tender for the Replacement heating system at Glossop Municipal Buildings, Glossop Derbyshire. 

The scope of requirements relates to the replacement of the Boilers and associated plant serving the Municipal Building and upgrading of the heating installation. 

The close of tender applications will be by 12 noon on Thursday 23rd December 2021. 
This exercise is being managed through the Council's Electronic tendering system ProContract. To Register an Interest and submit a tender for this opportunity please click on the link below:

Project reference number DN584288

You will need to register or log in (if you have already registered). If you have any queries or need assistance please contact us.

Reference: PROC-4868",,"SK13 8AF",,"50000000 ",,procurement@staffsmoorlands.gov.uk,"Town Hall",,Buxton,SK176EL,England,"0345 129 77 77",www.highpeak.gov.uk,,"https://procontract.due-north.com/Advert?advertId=b0b4a4a3-084e-ec11-810e-005056b64545&p=08c1102f-61ba-e711-80e6-005056b64545 ",,17/01/2022,31/03/2022,23/12/2021,NO,,Yes,No,No,Works,200000,,17/02/2022,182918,"[Phoenix Gas|Furlong Road 
Tunstall 
Stoke on Trent 
Staffs 
ST6 5UD|NONE_OTHER||No|No]",,17/02/2022,31/03/2022,"OpenNonOJEU ",,12:00
DN602321,Contract,"Redcar & Cleveland Borough Council",Awarded,2022-03-21T15:33:27Z,"Town Deal Culture & Leisure Anchor Attraction - Architect led Multi-Disciplinary Team","Provision of Architect led Multi-Disciplinary Team for the Redcar Town Deal - Culture and Leisure Anchor Attraction.
Services appointed via Bloom Framework, delivered by Ryder Architecture.",,,"North East","71220000 71310000 71320000 ",,procurement@redcar-cleveland.gov.uk,"Redcar & Cleveland House,Kirkleatham Street",,REDCAR,TS101RT,England,"01642 774774",,,,,01/02/2022,31/03/2026,12/11/2021,NO,,Yes,Yes,No,Services,0,,14/02/2022,554965,"[Bloom Procurement Services Ltd|Point 5 New Eden House, Fletcher Road, Gateshead, Tyne and Wear, NE8 2ET|COMPANIES_HOUSE|8045123|Yes|No]",,28/02/2022,31/03/2026,"CallOffFromFrameworkAgreement ",,14:00
CF-2008900D0O000000rwimUAA,Contract,"UK Health Security Agency",Awarded,2023-11-16T10:54:20Z,"Statista Research Portal","Commercial Market Intelligence",,"E14 5EA","Any region","79330000 ","Procurement Operations",Procurement.operations@dhsc.gov.uk,"10 South Colonnade",,London,"E14 5EA",GB,,,"20230221-Statista_Contract_Change_Notice_Signed1_Redacted.pdf ",,,21/02/2022,20/02/2023,20/02/2022,NO,,No,No,No,Products,9800,20300,17/02/2022,19600,"[STATISTA LIMITED|5th Floor, 209-215 Blackfriars Road SE1 8NL|NONE||Yes|No]",,21/02/2022,20/02/2023,"CallOffFromFrameworkAgreement ",,12:00
PRO1003443,Contract,"NHS PROPERTY SERVICES LIMITED",Awarded,2023-10-31T16:53:00Z,"Civils works for new  power supplies and Sub-Station at Clacton Hospital","Civil and general builders work in connection with the provision of a new upgraded electrical supply to the hospital to include construction of new sub station",,,"East Midlands","45000000 ","NHS PS Procurement",NHSPSContracts@property.nhs.uk,"7th Floor","10 South Colonnade",London,"E14 4PU",England,,,,,,16/02/2022,16/06/2022,31/01/2022,NO,,Yes,No,No,Works,330417.62,,16/02/2022,330417.62,"[FOREST GATE CONSTRUCTION CO. LIMITED|Southfields Industrial Estate
SS15 6TN
GB|COMPANIES_HOUSE|00451880|Yes|No]",,16/02/2022,16/06/2022,"CompetitiveQuotationNonOJEU ",,17:00
15N-22-TFTP,Contract,"NHS SOUTH, CENTRAL AND WEST COMMISSIONING SUPPORT UNIT",Awarded,2023-10-13T15:27:37+01:00,"NHS Devon - Targeted Family Therapy Plymouth","NHS Devon Integrated Care Board (formerly NHS Devon Clinical Commissioning Group sought to commission a targeted Family Therapy Service in Plymouth.    The aim of the service is to improve mental health and psychological wellbeing of children and young people with identified mental health needs referred to the service, enhancing their resilience and supporting their development and coping strategies.

The service will work collaboratively with health, education and/or social care colleague to maximise the potential for the child or young person's good mental health. 

The contract term is for 1 year commencing 01 April 2022.  The Annual Contract Value is £80,000",,,"South West","85100000 ",,d-icb.contracting@nhs.net,"NHS Devon ICB, County Hall, Topsham Road",,Exeter,"EX2 4QD","United Kingdom",,,,,"The services are healthcare services falling within Schedule 3 to the Public Contracts Regulations 2015 (""the Regulations"")  which are not subject to the full regime of the Regulations, but is instead governed by the ""Light Touch Regime"" contained within Chapter 3, Section 7 of the Regulations (Regulations 74 to 77).",01/04/2022,31/03/2023,14/02/2022,NO,,Yes,Yes,No,Services,80000,,15/02/2022,80000,"[Family Matters|46-48 Devonport Road
Stoke
Plymouth 
PL3 4DF|COMPANIES_HOUSE|05438661|Yes|Yes]",,01/04/2022,31/03/2023,"SingleTenderActionNonOJEU ",,12:00
CF-1896000D0O000000rwimUAA,Contract,"Health Education England - LEGACY MERGED",Awarded,2023-09-28T11:08:26+01:00,"Proud 2 B Parents CIC - NHS Education Contract","Funding for the education and training of the health and social care workforce",,"LS1 4PL","United Kingdom","80000000 ","Workforce Commercial Team",england.workforcecommercialteam@nhs.net,"Duncombe Street",,Leeds,"LS1 4PL",UK,,,"Proud 2 B Parents Completed Contract - Redacted.pdf ",,,01/04/2021,31/03/2024,31/03/2021,NO,,No,No,No,Services,10000,10000,15/02/2022,10000,"[Proud 2 B Parents CIC|30 Windsor Drive Bredbury Stockport Sk6 2EH|NONE||No|No]",,01/04/2021,31/03/2024,"Other ",,12:00
CF-1894700D0O000000rwimUAA,Contract,"Health Education England - LEGACY MERGED",Awarded,2023-09-27T13:17:43+01:00,"Positive Futures North Liverpool - NHS Education Contract","Funding for the education and training of the health and social care workforce",,"LS1 4PL","United Kingdom","80000000 ","Workforce Commercial Team",england.workforcecommercialteam@nhs.net,"Duncombe Street",,Leeds,"LS1 4PL",UK,,,"Positive Futures North Liverpool Completed Contract - Redacted.pdf ",,,01/04/2021,31/03/2024,31/03/2021,NO,,No,No,No,Services,10000,10000,15/02/2022,10000,"[Positive Futures North Liverpool|Unit B1 Tetlow Way Anfield L4 4QS|NONE||No|No]",,01/04/2021,31/03/2024,"Other ",,12:00
CF-1894000D0O000000rwimUAA,Contract,"Health Education England - LEGACY MERGED",Awarded,2023-09-27T11:35:34+01:00,"Physio Needs Ltd - NHS Education Contract","Funding for the education and training of the health and social care workforce",,"LS1 4PL","United Kingdom","80000000 ","Workforce Commercial Team",england.workforcecommercialteam@nhs.net,"Duncombe Street",,Leeds,"LS1 4PL",UK,,,"Please_DocuSign_NHS_Education_Contract_April (11) - Physio Needs Ltd - Redacted.pdf ",,,01/04/2021,31/03/2024,31/03/2021,NO,,No,No,No,Services,10000,10000,15/02/2022,10000,"[Physio Needs Ltd|Rogers Spencer Newstead House, Pelham Road, , NG5 1AP|NONE||No|No]",,01/04/2021,31/03/2024,"Other ",,12:00
CF-1893300D0O000000rwimUAA,Contract,"Health Education England - LEGACY MERGED",Awarded,2023-09-27T10:16:10+01:00,"Physio Matters (Chews Media Ltd) - NHS Education Contract","Funding for the education and training of the health and social care workforce",,"LS1 4PL","United Kingdom","80000000 ","Workforce Commercial Team",england.workforcecommercialteam@nhs.net,"Duncombe Street",,Leeds,"LS1 4PL",UK,,,"NHS_Education_Contract_April (24) Physio Matters (Chews Media Ltd) - Redacted.pdf ",,,01/04/2021,31/03/2024,31/03/2021,NO,,No,No,No,Services,10000,10000,15/02/2022,10000,"[Physio Matters (Chews Media Ltd)|Room 2 Chews Health HQ Orchard Place Timperley WA15 7UR|NONE||No|No]",,01/04/2021,31/03/2024,"Other ",,12:00
CF-1892700D0O000000rwimUAA,Contract,"Health Education England - LEGACY MERGED",Awarded,2023-09-27T09:18:06+01:00,"Physio & Therapy UK Ltd - NHS Education Contract","Funding for the education and training of the health and social care workforce",,"LS1 4PL","United Kingdom","80000000 ","Workforce Commercial Team",england.workforcecommercialteam@nhs.net,"Duncombe Street",,Leeds,"LS1 4PL",UK,,,"Please_DocuSign_NHS_Education_Contract_April (3) - Physio & Therapy UK Ltd - Redacted.pdf ",,,01/04/2021,31/03/2024,31/03/2021,NO,,No,No,No,Services,10000,10000,15/02/2022,10000,"[Physio & Therapy UK Ltd|45 Hallstile Bank Hexham NE46 3PQ|NONE||No|No]",,01/04/2021,31/03/2024,"Other ",,12:00
CF-1886800D0O000000rwimUAA,Contract,"Health Education England",Awarded,2023-09-25T14:55:38+01:00,"Physiotherapy Sheffield & Sports Injuries Clinic - NHS Education Contract","Education and Training",,,"United Kingdom","80000000 ","Commercial Team",workforcecommercialteam@hee.nhs.uk,"Duncombe Street",,Leeds,"LS1 4PL","United Kingdom",,,"(Redacted) NHS_Education_Contract_-_Physiotherapy_Sheffield_&_Sports_Injuries_Clinic_-_Apr_21-Mar_24.pdf ",,,01/04/2021,31/03/2024,31/03/2021,NO,,No,No,No,Services,10000,10000,15/02/2022,10000,"[Physiotherapy Sheffield & Sports Injuries Clinic|127 The Moor, Sheffield City Centre S1 4PH|NONE||No|No]",,01/04/2021,31/03/2024,"Other ",,12:00
CF-1885400D0O000000rwimUAA,Contract,"Health Education England - LEGACY MERGED.",Awarded,2023-09-25T11:54:12+01:00,"People First Merseyside Company - NHS Education Contract","Funding for the education and training of the health and social care workforce.",,"LS1 4PL","United Kingdom","80000000 ","Workforce Commercial Team",england.workforcecommercialteam@nhs.net,"Duncombe Street",,Leeds,"LS1 4PL",UK,,,"People First Merseyside Completed Contract (1) - Redacted.pdf ",,,01/04/2021,31/03/2024,31/03/2021,NO,,No,No,No,Services,10000,10000,15/02/2022,10000,"[People First Merseyside Company|The Investment Centre 375 Stanley Road L20 3EF|NONE||No|No]",,01/04/2021,31/03/2024,"Other ",,12:00
CF-1881600D0O000000rwimUAA,Contract,"Health Education England - LEGACY MERGED.",Awarded,2023-09-22T09:15:57+01:00,"Pennine Lancashire Community Farm - NHS Education Contract","Funding for the education and training of the health and social care workforce",,"LS1 4PL","United Kingdom","80000000 ","Workforce Commercial Team",england.workforcecommercialteam@nhs.net,"Duncombe Street",,Leeds,"LS1 4PL",UK,,,"Pennine Lancashire Community Farm Completed Contract - Redacted.pdf ",,,01/04/2021,31/03/2024,31/03/2021,NO,,No,No,No,Services,10000,10000,15/02/2022,10000,"[Pennine Lancashire Community Farm|Eco - Community Hub Burleigh street BB120DU|NONE||No|No]",,01/04/2021,31/03/2024,"Other ",,12:00
CF-1879700D0O000000rwimUAA,Contract,"Health Education England - LEGACY MERGED.",Awarded,2023-09-21T13:24:20+01:00,"Pendleside Hospice - NHS Education Contract","Funding for the education and training of the health and social care workforce",,"LS1 4PL","United Kingdom","80000000 ","Workforce Commercial Team",england.workforcecommercialteam@nhs.net,"Duncombe Street",,Leeds,"LS1 4PL",UK,,,"Pendleside Hospice Completed Contract - Redacted.pdf ",,,01/04/2021,31/03/2024,31/03/2021,NO,,No,No,No,Services,10000,10000,15/02/2022,10000,"[Pendleside Hospice|Pendleside Hospice Colne Road Burnley BB10 2LW|NONE||No|No]",,01/04/2021,31/03/2024,"Other ",,12:00
CF-1875900D0O000000rwimUAA,Contract,"Health Education England - LEGACY MERGED",Awarded,2023-09-20T09:08:38+01:00,"Park View Surgery - NHS Education Contract","Funding for the education and training of the health and social care workforce",,"LS1 4PL","United Kingdom","80000000 ","Workforce Commercial Team",england.workforcecommercialteam@nhs.net,"Duncombe Street",,Leeds,"LS1 4PL",GB,,,"Contract - Park View Surgery - Redacted.pdf ",,,01/04/2021,31/03/2024,31/03/2021,NO,,No,No,No,Services,10000,10000,15/02/2022,10000,"[Park View Surgery|23-24 Ribblesdale Place Preston PR1 3NA|NONE||No|No]",,01/04/2021,31/03/2024,"Other ",,12:00
CF-1874600D0O000000rwimUAA,Contract,"Health Education England - LEGACY MERGED.",Awarded,2023-09-19T11:27:12+01:00,"Out of Hours West Lancashire CIC- NHS Education Contract","Funding for the education and training of the health and social care workforce.",,"LS1 4PL","United Kingdom","80000000 ","Workforce Commercial Team",england.workforcecommercialteam@nhs.net,"Duncombe Street",,Leeds,"LS1 4PL",UK,,,"Out of Hours West Lancashire CIC - Contract - Redacted.pdf ",,,01/04/2021,31/03/2024,31/03/2021,NO,,No,No,No,Services,10000,10000,15/02/2022,10000,"[Out of Hours West Lancashire CIC|20 Dingle Road Upholland Skelmesdale Lancashire WN8 0EN|NONE||No|No]",,01/04/2021,31/03/2024,"Other ",,12:00
CF-1874500D0O000000rwimUAA,Contract,"Health Education England - LEGACY MERGED.",Awarded,2023-09-19T09:53:19+01:00,"Open Minds (NAViGO) - NHS Education Contract","Funding for the education and training of the health and social care workforce.",,"LS1 4PL","United Kingdom","80000000 ","Workforce Commercial Team",england.workforcecommercialteam@nhs.net,"Duncombe Street",,Leeds,"LS1 4PL",GB,,,"Open Minds (NAViGO) Grimsby Completed Contract - Redacted.pdf ",,,01/04/2021,31/03/2024,31/03/2021,NO,,No,No,No,Services,10000,10000,15/02/2022,10000,"[Open Minds (NAViGO) - NHS Education Contract|NAViGO House 3-7 Brighowgate Grimsby DN32 0QE|NONE||No|No]",,01/04/2021,31/03/2024,"Other ",,12:00
CF-1872000D0O000000rwimUAA,Contract,"NHS England",Awarded,2023-09-18T12:18:45+01:00,"Open Door Charity - NHS Education Contract","Funding for the education and training of the health and social care workforce.",,"LS1 4PL","United Kingdom","80000000 ","Workforce Commercial Team",england.workforcecommercialteam@nhs.net,"Duncombe Street",,Leeds,"LS1 4PL",GB,,,"Open Door Charity Completed Contract - Redacted.pdf ",,,01/04/2021,31/03/2024,31/03/2021,NO,,No,No,No,Services,10000,10000,17/02/2022,10000,"[Old Rectory Nursing Home|Rectory Lane Capenhurst,Chester CH1 6HN|NONE||No|No]",,01/04/2021,31/03/2024,"Other ",,12:00
CF-1844500D0O000000rwimUAA,Contract,"Health Education England",Awarded,2023-09-07T15:37:10+01:00,"The Salvation Army - NHS Education Contract","Funding for the education and training of the health and social care workforce.",,"LS1 4PL","United Kingdom","80000000 ","Commercial Team",england.workforcecommercialteam@nhs.net,"Duncombe Street",,Leeds,"LS1 4PL","United Kingdom",,,"Crossroads Salvation Army Completed Contract Redacted.pdf ",,,01/04/2021,31/03/2024,31/03/2021,NO,,No,No,No,Services,10000,10000,17/02/2022,10000,"[The Salvation Army|101 Newington Causeway SE1 6BN|NONE||No|No]",,01/04/2021,31/03/2024,"Other ",,12:00
CF-1842900D0O000000rwimUAA,Contract,"Health Education England",Awarded,2023-09-07T14:18:41+01:00,"Pendle View Medical Centre - NHS Education Contract","Funding for the education and training of the health and social care workforce.",,"LS1 4PL","United Kingdom","80000000 ","Commercial Team",england.workforcecommercialteam@nhs.net,"Duncombe Street",,Leeds,"LS1 4PL","United Kingdom",,,"Pendle View Medical Centre Completed Contract Redacted.pdf ",,,01/04/2021,31/03/2024,31/03/2021,NO,,No,No,No,Services,10000,10000,15/02/2022,10000,"[Pendle View Medical Centre|47 Arthur St, Brierfield BB9 5RZ|NONE||No|No]",,01/04/2021,31/03/2024,"Other ",,12:00
CF-1687200D0O000000rwimUAA,Contract,"King's College Trust",Awarded,2023-09-01T13:25:11+01:00,"Intellectual Property","KP0355 - Intellectual Property rights over building designs.",,"SE5 9NY",London,"79930000 ","Robert Stevenson",robert.stevenson9@nhs.net,"65 Goswell Road",,London,"EC1V 7EN",GB,,,,,,14/02/2022,15/02/2022,11/02/2022,NO,,No,No,No,Services,95000,95000,14/02/2022,95000,"[Skyroom London|Sutton Yard, 65 Goswell Road, London, EC1V 7EN EC1V 7EN|NONE||Yes|No]",,14/02/2022,15/02/2022,"Other ",,12:00
